<?xml version="1.0" encoding="UTF-8"?>
<!--
The contents of this file are subject to the terms of the Common Development
and Distribution License (the License). You may not use this file except in
compliance with the License.

You can obtain a copy of the License at http://www.netbeans.org/cddl.html
or http://www.netbeans.org/cddl.txt.

When distributing Covered Code, include this CDDL Header Notice in each file
and include the License file at http://www.netbeans.org/cddl.txt.
If applicable, add the following below the CDDL Header, with the fields
enclosed by brackets [] replaced by your own identifying information:
"Portions Copyrighted [year] [name of copyright owner]"

The Original Software is NetBeans. The Initial Developer of the Original
Software is Sun Microsystems, Inc. Portions Copyright 1997-2006 Sun
Microsystems, Inc. All Rights Reserved.
-->

<!DOCTYPE transformations PUBLIC "-//NetBeans//DTD Module Automatic Dependencies 1.0//EN" "http://www.netbeans.org/dtds/module-auto-deps-1_0.dtd">
<transformations version="1.0">

    <transformationgroup>
        <description>message-1</description>
        <exclusion codenamebase="a" prefix="false"/>
        <exclusion codenamebase="b" prefix="true"/>
        <transformation>
            <trigger-dependency type="older">
                <module-dependency codenamebase="orig" spec="1.1"/>
            </trigger-dependency>
            <implies>
                <result>
                    <module-dependency codenamebase="nue" spec="1.0"/>
                </result>
                <result>
                    <token-dependency name="Nue"/>
                </result>
            </implies>
        </transformation>
        <transformation>
            <trigger-dependency type="cancel">
                <package-dependency name="javax.death"/>
            </trigger-dependency>
            <implies>
                <result>
                    <module-dependency codenamebase="javax.death" major="1" spec="1.0"/>
                </result>
            </implies>
        </transformation>
    </transformationgroup>

    <transformationgroup>
        <description>message-1a</description>
        <transformation>
            <trigger-dependency type="older">
                <module-dependency codenamebase="stabilized" major="1"/>
            </trigger-dependency>
            <implies>
                <result>
                    <module-dependency codenamebase="stabilized" major="1" spec="1.0"/>
                </result>
            </implies>
        </transformation>
    </transformationgroup>

</transformations>
